Delegacia_Orgaos,Delegadotitular_Diretor,TipoTabela
001ª DP  Praça Mauá  Atendendo provisóriamente na sede da 4ªDP,Cláudio Vieira de Campos,Delegacias da Capital
"004ª DP  Praça da República  Praça Cristiano Ottoni, s/nº",Daniel Mayr Pereira da Costa,Delegacias da Capital
"005ª DP  Mem de Sá  Av. Gomes Freire, 320 - Centro",Marcus Henrique de Oliveira Alves,Delegacias da Capital
"006ª DP  Cidade Nova  Rua Prof. Clementino Fraga, 77",Maria Aparecida Salgado Mallet,Delegacias da Capital
"007ª DP  Santa Teresa  Rua Francisco de Castro, 5",Orlando Zaccone D Elia Filho,Delegacias da Capital
"009ª DP  Catete  Rua Pedro Américo, 1",Alexandre Henrique Duarte Braga,Delegacias da Capital
"010ª DP  Botafogo  Rua Bambina, 140",Tarcisio Andreas Jansen,Delegacias da Capital
"011ª DP  Rocinha  Rua Bertha Lutz, 84, São Conrado",Antonio Ricardo L. Nunes,Delegacias da Capital
"012ª DP  Copacabana  Rua Hilário de Gouveia, 102",Gabriel Ferrando de Almeida,Delegacias da Capital
"013ª DP   Ipanema  Av. Nsa. Sra. Copacabana, 1260",Cristiana Onorato Miguel Bento,Delegacias da Capital
"014ª DP  Leblon  Av. Humberto de Campos, 315",Monique Vidal da Silva Muniz,Delegacias da Capital
"015ª DP  Gávea   Rua Major Rubens Vaz, 170",José Alberto Pires Lage,Delegacias da Capital
"016ª DP  Barra da Tijuca   Praça Des.Araujo Jorge, s/nº",Marcus Vinicius Almeida Braga,Delegacias da Capital
"017ª DP  São Cristóvão   Rua São Cristóvão, 309",Mario Luiz da Silva,Delegacias da Capital
"018ª DP  Praça da Bandeira   Rua Barão de Iguatemi, 331",Alcides Alves Pereira,Delegacias da Capital
"019ª DP  Tijuca   Rua General Espírito Santo Cardoso, 208",Gilberto Dias,Delegacias da Capital
"020ª DP  Vila Isabel   Rua Luiz de Matos, nº 20",Barbara Lomba Bueno,Delegacias da Capital
"021ª DP  Bonsucesso   Av. Democráticos, 1322",Wellington Pereira Vieira,Delegacias da Capital
"022ª DP  Penha   Av. Lobo Junior, 750",Reginaldo Guilherme da Silva,Delegacias da Capital
"023ª DP  Méier   Rua Aristides Caire, 80",Luiz Archimedes Gomes de Azeredo,Delegacias da Capital
"024ª DP  Piedade   Rua Goiás, 404",Claudio Nascimento de Souza,Delegacias da Capital
"025ª DP  Engenho Novo  Rua Gal. Belford, 123 - Rocha",Herald Paquete Espinola Filho,Delegacias da Capital
"026ª DP  Todos os Santos  Rua Adriano, nº 304",Jader Machado Amaral,Delegacias da Capital
"027ª DP  Vicente de Carvalho   Rua Ana Frank, s/nº",Luiz Jorge Rodrigues da Silva,Delegacias da Capital
"028ª DP  Campinho   Rua Candido Benício, 727",William de Medeiros Pena Junior,Delegacias da Capital
"029ª DP  Madureira   Estrada do Portela, nº 391",Niandro Ferreira Lima,Delegacias da Capital
"030ª DP  Marechal Hermes   Rua Xavier Curado, nº 1707",José Otilio Bezerra,Delegacias da Capital
"031ª DP - Ricardo de Albuquerque  Estrada Marechal Alencastro, s/n",Rui Barboza de Souza,Delegacias da Capital
"032ª DP  Taquara  Rua Profª Francisca Piragibe, 80",Rodolfo Waldeck Penco Monteiro,Delegacias da Capital
"033ª DP  Realengo   Av. Mal. Fontenelle, s/nº - Jardim Sulacap",Márcia Cristiana Xavier Lopes,Delegacias da Capital
"034ª DP  Bangu   Rua Sabogi, 51",Marcus Antônio Neves Pereira,Delegacias da Capital
"035ª DP  Campo Grande  Av. Maria Teresa, 8",Marcelo Ambrósio,Delegacias da Capital
"036ª DP  Santa Cruz   AV. D. João VI, 67",Rodrigo Sebastian Santoro Nunes,Delegacias da Capital
"037ª DP  Ilha do Governador  Estr. do Galeão, 1365",Geraldo Assed Estefan,Delegacias da Capital
038ª DP  Irajá   R. Tenente Mateus Levino S.Nº,Delmir da Silva Gouvea,Delegacias da Capital
039ª DP  Pavuna   Rua Mercúrio s/nº,Edson Henrique Damasceno,Delegacias da Capital
"040ª DP  Honório Gurgel  Rua Guarama, 15",Paulo Henrique da Silva Pinto,Delegacias da Capital
"041ª DP  Tanque   Rua Henriqueta, 197",Adriana Cardoso Belem,Delegacias da Capital
"042ª DP - Recreio  Av. Teotônio  Vilela, nº31 - Recreio dos Bandeirantes",Marcia Helena Julião,Delegacias da Capital
"043ª DP  Guaratiba   Estrada do Piai, Qd. 89 Lt-7 e 8",Aglausio Batista Novais Filho,Delegacias da Capital
"044ª DP  Inhaúma  Av. Pastor Martin Luther King, s/nº",Roberto Ramos da Silva Santos,Delegacias da Capital
"045ªDP - Complexo do Alemão  Rua Nova sem número, Itararé ( entrada  pela Estação Itararé do Teleférico)",Fabio Asty Dantas,Delegacias da Capital
"1ª  DPA - Capital  Rua da Relação, 42",Paulo Cesar da Silva Guimarães,Delegacias da Capital
"2ª  DPA - Capital   Rua da Relação, 42",Flávio Marcos Amaral de Brito,Delegacias da Capital
"048ª DP  Seropédica   BR 465, antiga Rio/São Paulo, KM 42 - Campo Limpo",Julio da Silva Filho,DGPB - Departamento Geral de Polícia da Baixada
"050ª DP  Itaguaí   Rua Gal. Bocaiúva, 410",Jorge Farid Zahra,DGPB - Departamento Geral de Polícia da Baixada
051ª DP  Paracambi   Estr. RJ 127  KM 11 nº 153,Flavio da Rosa Loureiro,DGPB - Departamento Geral de Polícia da Baixada
"052ª DP  Nova Iguaçu   Av. Governador Amaral Peixoto, nº 950",Leandro Aquino da Silva,DGPB - Departamento Geral de Polícia da Baixada
"053ª DP  Mesquita   Av. Presidente Costa e Silva, nº1280",Matheus de Almeida Romanelli Lopes,DGPB - Departamento Geral de Polícia da Baixada
"054ª DP  Belford Roxo   Estrada Bento José Martins Silvares, 800",Luiz Henrique Ferreira Guimarães,DGPB - Departamento Geral de Polícia da Baixada
"055ª DP  Queimados   Rua Manuel Algusto Muquete, s/n",Marcos Celio Vieira Peralta,DGPB - Departamento Geral de Polícia da Baixada
"056ª DP  Comendador Soares  Rua Tomás da Fonseca, 399",Alexandre Roberto Dellsanto Gusman,DGPB - Departamento Geral de Polícia da Baixada
"057ª DP  Nilópolis   Estrada do Expedicionário, 84  Cabuis - Nilópolis",Marco Aurélio de Paula Ribeiro,DGPB - Departamento Geral de Polícia da Baixada
"058ª DP  Posse  Av. Henrique Duque Estrada Meyer, 149",Adriano Marcelo Firmo França,DGPB - Departamento Geral de Polícia da Baixada
"059ª DP  Duque de Caxias   Rua Ailton Costa, s/nº",Raissa Maria dos Santos Celles,DGPB - Departamento Geral de Polícia da Baixada
"060ª DP  Campos Elíseos   Rua Dr. Manoel Alves, s/nº",José de Moraes Ferreira,DGPB - Departamento Geral de Polícia da Baixada
"061ª DP  Xerém   Rua Maranhão, 5",José Afonso Mota,DGPB - Departamento Geral de Polícia da Baixada
062ª DP  Imbariê   Rua Mal.Hermes,Marcos Santana Gomes,DGPB - Departamento Geral de Polícia da Baixada
"063ª DP  Japeri   Estrada Vereador Francisco da Costa Filho,s/nº",Rodrigo Freitas,DGPB - Departamento Geral de Polícia da Baixada
"064ª DP  S. J.Meriti  Avenida Doutor Arruda Negreiro, s/nº",Roberto de Souza Cardoso,DGPB - Departamento Geral de Polícia da Baixada
"065ª DP  Magé   Praça Getúlio Vargas, 20",Angelo Jose Lages Machado,DGPB - Departamento Geral de Polícia da Baixada
"066ª DP  Piabetá   Av. Santos Dumont, s/nº",Antonio Silvino Teixeira,DGPB - Departamento Geral de Polícia da Baixada
"067ª DP  Guapimirim  Estrada do Bananal, 1919 - Bananal",Veronica Stiepanowez de Oliveira,DGPB - Departamento Geral de Polícia da Baixada
"3ª DPA - Baixada  Rua Ailton Costa, s/nº",Cley Biagio Catão,DGPB - Departamento Geral de Polícia da Baixada
"070ª DP  Tanguá  Rua Firmino Francisco Leite, s/nº",Raul Gustavo Morgado,DGPI - Departamento Geral de Polícia do Interior
"071ª DP  Itaboraí   Av. 22 de maio, 5.963",Oscar de Sa Alves,DGPI - Departamento Geral de Polícia do Interior
"072ª DP  São Gonçalo   Av. 18 do Forte, 578",Flavio Almeida Narcizo,DGPI - Departamento Geral de Polícia do Interior
"073ª DP  Neves   Rua Oliveira Botelho,s/nº",Carla Conceição Guimarães Tavares de Lima,DGPI - Departamento Geral de Polícia do Interior
"074ª DP  Alcântara   Praça Carlos Gianely, 15",Fabio Corsino Freire,DGPI - Departamento Geral de Polícia do Interior
"075ª DP  Rio do Ouro   Estr. Velha de Marica, s/nº",Marcos Antonio da Silva,DGPI - Departamento Geral de Polícia do Interior
076ª DP  Niterói   Ernani do Amaral Peixoto,Glaucio Paz da Silva,DGPI - Departamento Geral de Polícia do Interior
"077ª DP  Icaraí   Rua Lemos Cunha, 475",Robson da Costa Ferreira da Silva,DGPI - Departamento Geral de Polícia do Interior
"078ª DP  Fonseca   Alameda São Boaventura, 773",José William de Medeiros,DGPI - Departamento Geral de Polícia do Interior
"079ª DP  Jurujuba   Av. Quintino Bocaiúva, 115",Claudio Otero Ascoli,DGPI - Departamento Geral de Polícia do Interior
081ª DP  Itaipu   Av. Francisco da Cruz nº6666 - Piratininga,Lauro Cesar Lethier Rangel,DGPI - Departamento Geral de Polícia do Interior
"082ª DP  Maricá   Rua Athayde Parreira, s/nº",Julio Cesar Mulatinho Neto,DGPI - Departamento Geral de Polícia do Interior
"088ª DP  Barra do Piraí   Rua Paulo de Frontin, 132",Carina da Silva Bastos,DGPI - Departamento Geral de Polícia do Interior
"089ª DP  Resende   Rua Guita Ferreira da Rocha, s/nº",Marcelo Nunes Ribeiro,DGPI - Departamento Geral de Polícia do Interior
"090ª DP  Barra Mansa   Av. Domingos Mariano, s/nº",Ronaldo Aparecido Ferreira Brito,DGPI - Departamento Geral de Polícia do Interior
"091ª DP  Valença   Rodovia RJ, 145-lote 28",Luciano Coelho dos Santos,DGPI - Departamento Geral de Polícia do Interior
"092ª DP  Rio das Flores   Rua João Carvalho da Rocha, 71",Luciano Coelho dos Santos,DGPI - Departamento Geral de Polícia do Interior
"093ª DP  Volta Redonda   Rua Lucas Evangelista, 667",Eliezer Lourenço Costa,DGPI - Departamento Geral de Polícia do Interior
094ª DP  Piraí   Rua 15 de Novembro 290,Marco Antonio de A. Alves,DGPI - Departamento Geral de Polícia do Interior
"095ª DP  Vassouras   Av. Mal. Paulo Torres, 477",Renato Soares Vieira,DGPI - Departamento Geral de Polícia do Interior
"096ª DP   Miguel Pereira   Rua Zeni Esteves, s/nº-Pça da Band",Marcello Braga Maia,DGPI - Departamento Geral de Polícia do Interior
"097ª DP  Mendes   Rua Maria Caetana, 54",Luiz Fernando Nader Damasceno,DGPI - Departamento Geral de Polícia do Interior
"098ª DP  Eng. Paulo de Frontin  RJ/127 22125, São Lourenço",Luiz Fernando Nader Damasceno,DGPI - Departamento Geral de Polícia do Interior
"099ª DP  Itatiaia   Av. Dois, Lote A - Jardim Itatiaia",Vicente Maximiliano Rodrigues Barbosa,DGPI - Departamento Geral de Polícia do Interior
"100ª DP  Porto Real   Rua Ariosto Roberto Pederassi, 570",Marcelo dos Santos Haddad,DGPI - Departamento Geral de Polícia do Interior
"101ª DP  Pinheiral   Rua José Breves, 294 - Central",Antonio da Luz Furtado,DGPI - Departamento Geral de Polícia do Interior
"104ª DP  São J. V. Rio Preto   Rua Alfredo Jacintho Franco, s/nº",Paulo César Vieira,DGPI - Departamento Geral de Polícia do Interior
"105ª DP  Petrópolis   Avenida Barão do Rio Branco, s/nº.",Cláudio Batista Teixeira,DGPI - Departamento Geral de Polícia do Interior
"106ª DP  Itaipava   Estrada União Indústria, 8.764",Nei José Ramos Costa,DGPI - Departamento Geral de Polícia do Interior
"107ª DP  Paraíba do Sul   Praça Garcia, 27",Claudia Teresa Nardy Abbud,DGPI - Departamento Geral de Polícia do Interior
"108ª DP  Três Rios   Av. Castro Alves, 116",Andre Luiz Pinto Lourenço,DGPI - Departamento Geral de Polícia do Interior
"109ª DP  Sapucaia   Rua Rafael Langone,600",Marcelo Cunha Vieira,DGPI - Departamento Geral de Polícia do Interior
"110ªDP  Teresópolis   Av. Alberto Torres, 569",Paulo Roberto Lima de Freitas,DGPI - Departamento Geral de Polícia do Interior
"111ª DP  Sumidouro   Rua Carlos Alberto P. de Moura Junior, 74",Vinicius Paiva Galhardo,DGPI - Departamento Geral de Polícia do Interior
"112ª DP  Carmo   Praça Alexandre de Mello, 109",Herbert Tavares Cardoso,DGPI - Departamento Geral de Polícia do Interior
"118ª DP  Araruama   Rua Bernardo de Vasconcelos, 755",Luiz Henrique Marques Pereira,DGPI - Departamento Geral de Polícia do Interior
"119ª DP  Rio Bonito    Av.Antonio Carlos de Souza Guadelupe, s/nº - Green Valley",Carlos Eduardo Pereira Almeida,DGPI - Departamento Geral de Polícia do Interior
"120ª DP  Silva Jardim    RuaComandante Pereira Filho, 51",Juaraci Rodrigues Cardoso Vieira,DGPI - Departamento Geral de Polícia do Interior
"121ª DP  Casemiro de Abreu    Rua Geny da Cruz Leite, s/nº",Daniela dos Santos Rebelo Pinto,DGPI - Departamento Geral de Polícia do Interior
"122ª DP  Conceição de Macabu   Rua Plácido Freire, 72",Franquis Dias Nepomuceno,DGPI - Departamento Geral de Polícia do Interior
"123ª DP  Macaé    Rua São João, nº 35  Centro - Macaé",Filipi Poeys Lima,DGPI - Departamento Geral de Polícia do Interior
"124ª DP  Saquarema   Rua Dr. Luiz Januário, 201",Leonardo Luis Macharet,DGPI - Departamento Geral de Polícia do Interior
"125ª DP - São Pedro D´Adeia  Av. Nsa. Sra. Fátima, frte 312",Jorge Luiz da Silva Veloso,DGPI - Departamento Geral de Polícia do Interior
"126ª DP  Cabo Frio   Rua Teixeira e Souza, s/nº",Renato dos Santos Mariano,DGPI - Departamento Geral de Polícia do Interior
127ª DP  Armação de Búzios   Avenida Parque s/n,Rômulo Prado de Mesquita,DGPI - Departamento Geral de Polícia do Interior
"128ª DP  Rio das Ostras   Av. Jane Maria Martins Figueira, s/n/ -  Jardim Marileia",Juliana Rattes C. de Queiroz,DGPI - Departamento Geral de Polícia do Interior
"129ª DP  Iguaba Grande  Rua Profeta Jeremias, s/nº",Janaina Cristina Peregrino,DGPI - Departamento Geral de Polícia do Interior
"130ª DP  Quissamã  Estrada do Correio Imperial, s/nº - Piteiras",Ivailson Moreira Sardinha,DGPI - Departamento Geral de Polícia do Interior
"132ª DP  Arraial do Cabo  Av. General Bruno Martins, s/nº",Flavia Goes Monteiro Romero de Barros,DGPI - Departamento Geral de Polícia do Interior
"134ª DP  Campos    Rua Barão de Miracema, 231",Geraldo Rangel de Andrade Júnior,DGPI - Departamento Geral de Polícia do Interior
"135ª DP  Itaocara   Av. Roberto Silveira, 84",Luiz Augusto Carvalho de Souza,DGPI - Departamento Geral de Polícia do Interior
"136ª DP  S. Antônio de Pádua   Rua Arthur Silva, 151",Rudolph Bruno Anastácio,DGPI - Departamento Geral de Polícia do Interior
"137ª DP  Miracema    Rua Irineu Sodré, 178",Vilson de Almeida Silva,DGPI - Departamento Geral de Polícia do Interior
"138ª DP  Laje do Muriaé   Rua Hélio M. de Sá, s/nº",Bruno Cleuder de Melo,DGPI - Departamento Geral de Polícia do Interior
"139ª DP  Porciúncula    Rua Antônio Duarte, s/nº",Uillian Rodrigues Costa,DGPI - Departamento Geral de Polícia do Interior
"140ª DP  Natividade   Av. Gov. Roberto Silveira, s/nº",Gesner Cesar Bruno,DGPI - Departamento Geral de Polícia do Interior
"141ª DP  São Fidelis   Av. Pres. Kennedy, 17",Rodrigo Vinicius Andrade Maia,DGPI - Departamento Geral de Polícia do Interior
"142ª DP  Cambuci   Rua 13 de Maio, 303",Luiz Augusto Carvalho de Souza,DGPI - Departamento Geral de Polícia do Interior
143ª DP  Itaperuna   Delegacia Delegado Titular Telefones,Márcio Caldas Dias Mello,DGPI - Departamento Geral de Polícia do Interior
"144ª DP  B. Jesus Itabapoana   Av. Gov. Roberto Silveira, 148",Avelino C. L. Filho,DGPI - Departamento Geral de Polícia do Interior
145ª DP  São João da Barra  Rod. BR 356  Campos - Atafona,Carlos Augusto G. da Silva,DGPI - Departamento Geral de Polícia do Interior
146ª DP  Guarus   Rua Patrício Menezes e Hipólito Sardinha,Luis Mauricio Armond Campos,DGPI - Departamento Geral de Polícia do Interior
"147ª DP  S Francisco Itabapoana   Rua Joaquim da Mota Sobrinho, 230",Ivana Maria Peres Morgado,DGPI - Departamento Geral de Polícia do Interior
"148ª DP  Italva  Rua Aristides Gonçalves de Souza, s/nº",Maurício Barros de Azevedo,DGPI - Departamento Geral de Polícia do Interior
"151ª DP  Nova Friburgo  Rua Teresópolis, s/nº",Mario Roberto Arruda,DGPI - Departamento Geral de Polícia do Interior
"152ª DP  Duas Barras   Rua Getúlio Vargas, 22",Mariana Thomé de Moraes,DGPI - Departamento Geral de Polícia do Interior
"153ª DP  Cantagalo   Rua Getúlio Vargas, 114",Carlos Alexandre Leite Justiniano,DGPI - Departamento Geral de Polícia do Interior
"154ª DP  Cordeiro  Av. Pres. Vargas, 296",Robson Pizzo Braga,DGPI - Departamento Geral de Polícia do Interior
"155ª DP  São Sebastião do Alto  Cel. Fco. Salustiano Pinto, 210",Renato José Mascarenhas Perez,DGPI - Departamento Geral de Polícia do Interior
"156ª DP  Santa Maria Madalena   Rua Cel. Brás, s/nº",Carla Vargas de Oliveira,DGPI - Departamento Geral de Polícia do Interior
"157ª DP  Trajano de Moraes   Alameda Rui Barbosa, s/nº",Henrique Paulo Mesquita Pessoa,DGPI - Departamento Geral de Polícia do Interior
"158ª DP  Bom Jardim   Praça Gov. Roberto Silveira, 170",Gilberto Soares da Silva,DGPI - Departamento Geral de Polícia do Interior
"159ª DP  Cachoeira de Macacu   Av. Lord Baden Powel, 93",Clovis Souza Moreira,DGPI - Departamento Geral de Polícia do Interior
"165ª DP  Mangaratiba   Estrada São João Marcos, s/nº",Milton Siqueira Junior,DGPI - Departamento Geral de Polícia do Interior
"166ª DP  Angra dos Reis   Rua Dr. Coutinho, 6",Bruno Gilaberte Freitas Savignon,DGPI - Departamento Geral de Polícia do Interior
"167ª DP  Paraty  Rua Roberto da Silveira , s/n",Uriel Alcantara Machado Nunes,DGPI - Departamento Geral de Polícia do Interior
"168ª DP  Rio Claro   Rua Fagundes de Varela, 74",Michel André Murillo Floroschk,DGPI - Departamento Geral de Polícia do Interior
"4ª DPA Região dos Lagos, Niterói e São Gonçalo  Rua Dr. Porciúncula s/nº, Venda da Cruz, São Gonçalo",Jose Renato Magnani Chernicharo,DGPI - Departamento Geral de Polícia do Interior
"5ª DPA - Sul Fluminense e Costa Verde  Rua Pinto Ribeiro, nº 330, Centro, Barra Mansa",Francisco Benitez Lopes,DGPI - Departamento Geral de Polícia do Interior
"6ª DPA - Campos - Norte Fluminense  Rua Barão de Miracema nº 231, Centro, Campos",Daniel José Bandeira de Melo Gomes,DGPI - Departamento Geral de Polícia do Interior
"7ª DPA - Região Serrana  Rua Alberto Torres nº 531, Alto, Teresópolis",Alexandre Ziehe,DGPI - Departamento Geral de Polícia do Interior
"10ª DEAC    Av. Brás de Pina, 1115",Francisco Coelho da Silva,CDEAC - Coordenadoria das delegacias de Acervo Cartorário
"11ª DEAC  Rua Cap. Gaspar Soares, 301 - Nova Iguaçu",Gisele Rosemberg,CDEAC - Coordenadoria das delegacias de Acervo Cartorário
"12ª DEAC   Rua Defensor Público Zilmar Pinaud, nº 163  São João de Meriti",Antenor de Castro Rego Neto,CDEAC - Coordenadoria das delegacias de Acervo Cartorário
"13ª DEAC   Rua Benjamin Constant, s/nº - Piabetá",Anderson Ribeiro Pinto,CDEAC - Coordenadoria das delegacias de Acervo Cartorário
"15ª DEAC  Rua São João, 370, Centro de Niterói",Edgar Antonio Cumani,CDEAC - Coordenadoria das delegacias de Acervo Cartorário
"16ª DEAC   Rua São João, 370, Centro de Niterói",José de Albuquerque Magalhães Junior,CDEAC - Coordenadoria das delegacias de Acervo Cartorário
"CGDEAC  Rua da Relação, 42 - 11º andar",Jose Augusto Pereira de Souza,CDEAC - Coordenadoria das delegacias de Acervo Cartorário
"CIAC  Rua Pedro Alves, 187 - Stº Cristo",Antonio Ricardo L. Nunes,CDEAC - Coordenadoria das delegacias de Acervo Cartorário
"DEAM  Cabo Frio   Av. Teixeira e Souza, s/nº São Cristóvão Claudia",Claudia Marcia Faissal G. R. Nogueira,DPAM - Divisão de Polícia de Atendimento à Mulher
DEAM - Angra dos Reis  Rua Doutor Coutinho nº 6 Centro,Ana Carla Rodrigues Moura Duarte,DPAM - Divisão de Polícia de Atendimento à Mulher
"DEAM  Belford Roxo  Av. Retiro da Imprensa, 800",Tatiana Ribeiro Q. de Oliveira,DPAM - Divisão de Polícia de Atendimento à Mulher
"DEAM  Campo Grande  Av. Cesário de Melo, 4.138- Campo Grande",Daniele Marques Amorim,DPAM - Divisão de Polícia de Atendimento à Mulher
"DEAM - Campos  Rua barão de Miracema, 231 - Centro",Ana Paula de Oliveira Carvalho,DPAM - Divisão de Polícia de Atendimento à Mulher
"DEAM  Centro  Rua Visconde do Rio Branco, 12",Elisa Borboni de Andrade,DPAM - Divisão de Polícia de Atendimento à Mulher
"DEAM  Duque Caxias  Rua Tem. José Dias, 344",Giselle do Espírito Santo,DPAM - Divisão de Polícia de Atendimento à Mulher
"DEAM  Jacarepaguá  Rua Henriqueta, 197",Viviane da Costa Ferreira Pinto,DPAM - Divisão de Polícia de Atendimento à Mulher
"DEAM  Niterói  Av. Amaral Peixoto, 577, 3º Andar",Alriam Miranda Fernandes,DPAM - Divisão de Polícia de Atendimento à Mulher
"DEAM - Nova Friburgo  Av. Presidente Costa e Silva, .501 Centro - Nova Fribugo",Danielle Christine Bessa Netto,DPAM - Divisão de Polícia de Atendimento à Mulher
"DEAM  Nova Iguaçu  Av. Governador Amaral Peixoto, 950 Nova Iguaçu - Centro",Cristiane Carvalho de Almeida,DPAM - Divisão de Polícia de Atendimento à Mulher
"DEAM  São Gonçalo  Av. 18 do Forte, 578",Débora Ferreira Rodrigues,DPAM - Divisão de Polícia de Atendimento à Mulher
"DEAM  São João de Meriti  Avenida Doutor Arruda Negreiro, s/nº - 3º Andar.",Elisa Borboni de Andrade,DPAM - Divisão de Polícia de Atendimento à Mulher
"DEAM  Volta Redonda  Av. Lucas Evangelista, 667, 3º andar",Maria Madalena Carnevale Alves Tomelin,DPAM - Divisão de Polícia de Atendimento à Mulher
DPAM,Marcia Noeli Barreto,DPAM - Divisão de Polícia de Atendimento à Mulher
CORE  Av. Dom Hélder Câmara nº 2066,Rodrigo Teixeira de Oliveira,DGPE - Departamento Geral de Polícia Especializada
DAIRJ  Aeroporto Internacional 1ºandar,Patricia de Paiva Aguiar,DGPE - Departamento Geral de Polícia Especializada
"DAS  Av. Afrânio de Mello, 159 - Leblon",Claudio Luiz Gois da Silva,DGPE - Departamento Geral de Polícia Especializada
DC  Polinter Sede  Av. Dom Hélder Câmara nº 2066,Márcio Mendonça Dubugras,DGPE - Departamento Geral de Polícia Especializada
"DCAV  Rua do Lavradio, nº 155",Juliana Emerique de Amorim,DGPE - Departamento Geral de Polícia Especializada
DCOD   Av. Dom Hélder Câmara nº 2066,Felipe Lobato Curi,DGPE - Departamento Geral de Polícia Especializada
DDEF  Av. Dom Hélder Câmara nº 2066,José Luiz Silva Duarte,DGPE - Departamento Geral de Polícia Especializada
DDPA - Del. de Descoberta de Paradeiros   Av. Dom Hélder Câmara nº 2066,Elen Gomes Pereira Souto,DGPE - Departamento Geral de Polícia Especializada
DDSD (Del.Defesa Serviços Delegados)  Av. Dom Hélder Câmara nº 2066,Roberto Gomes Nunes,DGPE - Departamento Geral de Polícia Especializada
"DEAPTI  Rua Figueiredo de Magalhães, 526 Copacabana",Marcos Cipriano de Oliveira Mello,DGPE - Departamento Geral de Polícia Especializada
"DEAT  Av. Afranio de Melo Franco, 159",Valeria de Aragão Sádio,DGPE - Departamento Geral de Polícia Especializada
DECON  Av. Dom Hélder Câmara nº 2066,Ricardo Barboza de Souza,DGPE - Departamento Geral de Polícia Especializada
"Del. de Homicídios da Baixada Fluminense  Avenida Florípedes da Rocha, 38 -  B. Roxo",Giniton Lages,DGPE - Departamento Geral de Polícia Especializada
"Del. de Homicídios de Niterói, São Gonçalo e Itaboraí   Rua Desiderio de Oliveira, nº.33, - Niterói",Fabio Oliveira Barucke,DGPE - Departamento Geral de Polícia Especializada
"Delegacia de Homicídios da Capital   Av. Ministro Ivan Raposo , s/n - Barra da Tijuca",Fábio Cardoso Júnior,DGPE - Departamento Geral de Polícia Especializada
DELFAZ  Av. Dom Hélder Câmara nº 2066,Gilberto da Cruz Ribeiro,DGPE - Departamento Geral de Polícia Especializada
DFAE  Av. Dom Hélder Câmara nº 2066,Rafael Willis Fernandez,DGPE - Departamento Geral de Polícia Especializada
"DPCA  Centro  Rua do Lavradio, nº 155",Deoclécio Francisco de Assis Filho,DGPE - Departamento Geral de Polícia Especializada
"DPCA  Niteroi  Av. Ernane do Amaral Peixoto, 577",Pedro Henrique Brandão Medina,DGPE - Departamento Geral de Polícia Especializada
DPMA  Av. Dom Hélder Câmara nº 2066,José Luiz Silva Duarte,DGPE - Departamento Geral de Polícia Especializada
"DRACO-IE   Praça Cristiano Otoni, nº324, 3ª andar",Alexandre Herdy Barros Silva,DGPE - Departamento Geral de Polícia Especializada
DRCI  Av. Dom Hélder Câmara nº 2066,Daniela Campos Rodriguez Terra,DGPE - Departamento Geral de Polícia Especializada
"DRCPIM  Av Dom Hélder Câmara, 2066",Celso Gustavo Castello Ribeiro,DGPE - Departamento Geral de Polícia Especializada
"DRF  Av. D. Helder Câmara, 2.066",Hilton Pinho Alonso,DGPE - Departamento Geral de Polícia Especializada
DRFA    Av. Dom Hélder Câmara nº 2066,Alesandro Petralanda Santos,DGPE - Departamento Geral de Polícia Especializada
DRFC  Av. Dom Hélder Câmara nº 2066,Mauricio Mendonça de Carvalho,DGPE - Departamento Geral de Polícia Especializada
"DS - Delegacia Supervisora  Rua da Relação, 42, Térreo Centro - Rio",Luiz Carlos Tucher,DGPE - Departamento Geral de Polícia Especializada
"1ª CRP - Grande Niterói  Rua São João, 370 - Centro",Armando Marcio Zuccarelli,CRPI - Coordenadoria Regional de Polícia do Interior
"2ª CRP - Serrana  Praça Prefeito Feliciano Costa, 1 - Nova Friburgo",Henrique Oliveira Vianna,CRPI - Coordenadoria Regional de Polícia do Interior
"3ª CRP - Região dos Lagos  Av. Bernardos Vasconcelos, 555 - Araruama",Tércia Amoêdo Silveira,CRPI - Coordenadoria Regional de Polícia do Interior
"4ª CRP - Macaé  Rua Barão de Miracema, 231",Jose Geraldo de Souza Araujo,CRPI - Coordenadoria Regional de Polícia do Interior
"5ª CRP - Norte  Rua Cel. Luiz Ferraz, 307",Antônio das Graças Francisco Ragozo,CRPI - Coordenadoria Regional de Polícia do Interior
"6ª CRP - Sul Fluminense e Costa Verde  Rua Pinto Ribeiro, 330- Barra Mansa",Wilson Raimundo de Melo,CRPI - Coordenadoria Regional de Polícia do Interior
"ACADEPOL  Rua Frei Caneca, 163 - Centro",Carolina Salomão Albuquerque,Orgãos
"ANL - Assist. de Normas e Legislação  Rua da Relação, 42 - 11º Andar - Centro",Fernando Vila Pouca de Souza,Orgãos
"ASPLAN - Assessoria Geral de Planejamento e Controle  Rua da Relação, 42 - 10º",Fabíola Martire Machado Willis Fernandez,Orgãos
